{"schemaVersion":2,"kind":"hvp-native-source-lock","approvedSourceIds":["mpv","ffmpeg","libplacebo","libass","spirv-cross","glslang","fast-float","freetype","fribidi","harfbuzz","zlib","jinja","markupsafe"],"sources":[
{"id":"mpv","version":"v0.41.0","tag":"v0.41.0","tagObject":"2c219aa822df18a1b7fd9abe3e151cd93ad67307","commit":"41f6a645068483470267271e1d09966ca3b9f413","archive":{"name":"mpv.tar.gz","url":"https://github.com/mpv-player/mpv/archive/41f6a645068483470267271e1d09966ca3b9f413.tar.gz","allowedRedirectHosts":["github.com","codeload.github.com"],"sha256":"068960e89211f2adc80af03f637fa393fb5e407d3dd23592c8fe8c5490bb7ae4"},"signature":{"status":"pending","fingerprint":null,"evidence":null},"pinToCommit":"pending","licenseDeclared":"NOASSERTION","licenseConcluded":null,"owner":"mpv-player","patches":[]},
{"id":"ffmpeg","version":"n6.1.6","tag":"n6.1.6","tagObject":"9266ee001cb04b9dd6ff0335022bd986e2bc8e8b","commit":"f1e3a2bf7a2f2cde936d1ed97f09a26853d20125","archive":{"name":"ffmpeg-6.1.6.tar.xz","url":"https://ffmpeg.org/releases/ffmpeg-6.1.6.tar.xz","allowedRedirectHosts":["ffmpeg.org"],"sha256":"d4fcb164028dd3beee5d92c0ac72e46aac6973c75ea12dc14de07bf8f407370a"},"signature":{"status":"pending","fingerprint":null,"evidence":"Detached upstream archive signature must be verified and bound to tag n6.1.6 before production use."},"pinToCommit":"pending","licenseDeclared":"NOASSERTION","licenseConcluded":null,"owner":"FFmpeg","patches":[]},
{"id":"libplacebo","version":"v6.338.2","tag":"v6.338.2","tagObject":"25ff836306a30e303ea524d1e276a51f2866e7f0","commit":"64c1954570f1cd57f8570a57e51fb0249b57bb90","archive":{"name":"libplacebo.tar.gz","url":"https://github.com/haasn/libplacebo/archive/64c1954570f1cd57f8570a57e51fb0249b57bb90.tar.gz","allowedRedirectHosts":["github.com","codeload.github.com"],"sha256":"3144bb66bc9e286da37f17f71886d65a6d1baf9e45e4efa5ac8bd61ffa935487"},"signature":{"status":"revoked","fingerprint":null,"evidence":"Alternative hash and independent evidence required; revoked key is never sole evidence."},"pinToCommit":"pending","licenseDeclared":"LGPL-2.1-or-later","licenseConcluded":null,"owner":"haasn","patches":[]},
{"id":"libass","version":"0.17.5","tag":"0.17.5","tagObject":"64ebcac709d949e6059bdacf5356c3af7848e8e5","commit":"4a05d8127f525943ebf45fdc6497c9e665947f0d","archive":{"name":"libass-0.17.5.tar.xz","url":"https://github.com/libass/libass/releases/download/0.17.5/libass-0.17.5.tar.xz","allowedRedirectHosts":["github.com","objects.githubusercontent.com","release-assets.githubusercontent.com"],"sha256":"2dca25c0e0c837ddf00b52011b3f82cac1e4ddd3ad018227806b0c2288864acc"},"signature":{"status":"not-available-reviewed","fingerprint":null,"evidence":"Archive hash recorded; signature availability reviewed."},"pinToCommit":"pending","licenseDeclared":"ISC","licenseConcluded":null,"owner":"libass","patches":[]},
{"id":"spirv-cross","version":"vulkan-sdk-1.4.357.0","tag":"vulkan-sdk-1.4.357.0","tagObject":null,"commit":"6c09849fe88c48eaed08413aa022aaa136a3a057","archive":{"name":"spirv-cross.tar.gz","url":"https://github.com/KhronosGroup/SPIRV-Cross/archive/6c09849fe88c48eaed08413aa022aaa136a3a057.tar.gz","allowedRedirectHosts":["github.com","codeload.github.com"],"sha256":"b81b9956289950570953738e666a031ca32ff64e4fc925eba89f227c42109518"},"signature":{"status":"pending","fingerprint":null,"evidence":null},"pinToCommit":"pending","licenseDeclared":"Apache-2.0","licenseConcluded":null,"owner":"KhronosGroup","patches":[]},
{"id":"glslang","version":"16.5.0","tag":"16.5.0","tagObject":null,"commit":"a8d28bd082bff18ffbe80996e922b012f915cf07","archive":{"name":"glslang.tar.gz","url":"https://github.com/KhronosGroup/glslang/archive/a8d28bd082bff18ffbe80996e922b012f915cf07.tar.gz","allowedRedirectHosts":["github.com","codeload.github.com"],"sha256":"a2e64a2803b8f7a8926d401cb13f3774ccf8517986fc065a285ce349fae5fe50"},"signature":{"status":"pending","fingerprint":null,"evidence":null},"pinToCommit":"pending","licenseDeclared":"Apache-2.0","licenseConcluded":null,"owner":"KhronosGroup","patches":[]},
{"id":"fast-float","version":"libplacebo-submodule","tag":null,"tagObject":null,"commit":"2b2395f9ac836ffca6404424bcc252bff7aa80e4","archive":{"name":"fast-float.tar.gz","url":"https://github.com/fastfloat/fast_float/archive/2b2395f9ac836ffca6404424bcc252bff7aa80e4.tar.gz","allowedRedirectHosts":["github.com","codeload.github.com"],"sha256":"230d20e4e4ac1f6a9df92c4d746c6ec536cdb0c085bc8635d4b88cead5dc22cb"},"signature":{"status":"pending","fingerprint":null,"evidence":null},"pinToCommit":"pending","licenseDeclared":"MIT","licenseConcluded":null,"owner":"fastfloat","patches":[]},
{"id":"freetype","version":"VER-2-14-3","tag":"VER-2-14-3","tagObject":null,"commit":"0a0221a1347e2f1e07c395263540026e9a0aa7c7","archive":{"name":"freetype.tar.gz","url":"https://github.com/freetype/freetype/archive/0a0221a1347e2f1e07c395263540026e9a0aa7c7.tar.gz","allowedRedirectHosts":["github.com","codeload.github.com"],"sha256":"11cd478953fc1d382f20a233b8e2aed6c31b47cbf0568c4bdb3334bcc1550698"},"signature":{"status":"pending","fingerprint":null,"evidence":null},"pinToCommit":"pending","licenseDeclared":"FTL OR GPL-2.0-or-later","licenseConcluded":null,"owner":"freetype","patches":[]},
{"id":"fribidi","version":"v1.0.16","tag":"v1.0.16","tagObject":null,"commit":"68162babff4f39c4e2dc164a5e825af93bda9983","archive":{"name":"fribidi.tar.gz","url":"https://github.com/fribidi/fribidi/archive/68162babff4f39c4e2dc164a5e825af93bda9983.tar.gz","allowedRedirectHosts":["github.com","codeload.github.com"],"sha256":"fa34a057a414c85f7e1f3c0fd717bc93d74d370ed474ef2feca90868b4938f72"},"signature":{"status":"pending","fingerprint":null,"evidence":null},"pinToCommit":"pending","licenseDeclared":"LGPL-2.1-or-later","licenseConcluded":null,"owner":"fribidi","patches":[]},
{"id":"harfbuzz","version":"14.3.1","tag":"14.3.1","tagObject":null,"commit":"ab5ecbb83985034a76214ac0b2b833dcd590d774","archive":{"name":"harfbuzz.tar.xz","url":"https://github.com/harfbuzz/harfbuzz/releases/download/14.3.1/harfbuzz-14.3.1.tar.xz","allowedRedirectHosts":["github.com","objects.githubusercontent.com","release-assets.githubusercontent.com"],"sha256":"9dae9538aae2ffdf70cec31f2c27bf68e2aaeeae3112688467697d5faf6194f7"},"signature":{"status":"not-available-reviewed","fingerprint":null,"evidence":"Archive hash recorded; signature availability reviewed."},"pinToCommit":"pending","licenseDeclared":"MIT","licenseConcluded":null,"owner":"harfbuzz","patches":[]},
{"id":"zlib","version":"v1.3.2","tag":"v1.3.2","tagObject":null,"commit":"da607da739fa6047df13e66a2af6b8bec7c2a498","archive":{"name":"zlib-1.3.2.tar.xz","url":"https://zlib.net/zlib-1.3.2.tar.xz","allowedRedirectHosts":["zlib.net","www.zlib.net"],"sha256":"d7a0654783a4da529d1bb793b7ad9c3318020af77667bcae35f95d0e42a792f3"},"signature":{"status":"pending","fingerprint":null,"evidence":"Upstream publishes zlib-1.3.2.tar.xz.asc; detached signature verification is required before production use."},"pinToCommit":"pending","licenseDeclared":"Zlib","licenseConcluded":null,"owner":"madler","patches":[]},
{"id":"jinja","version":"libplacebo-build-input","tag":null,"tagObject":null,"commit":"b08cd4bc64bb980df86ed2876978ae5735572280","archive":{"name":"jinja.tar.gz","url":"https://github.com/pallets/jinja/archive/b08cd4bc64bb980df86ed2876978ae5735572280.tar.gz","allowedRedirectHosts":["github.com","codeload.github.com"],"sha256":"9a20bab550a760ccb9b38a45d4fe76be92649206ee04633c646d0935a1872b0e"},"signature":{"status":"pending","fingerprint":null,"evidence":null},"pinToCommit":"pending","licenseDeclared":"BSD-3-Clause","licenseConcluded":null,"owner":"pallets","patches":[]},
{"id":"markupsafe","version":"libplacebo-build-input","tag":null,"tagObject":null,"commit":"c0254f0cfe51720ecc9e72e8896022af29af5b44","archive":{"name":"markupsafe.tar.gz","url":"https://github.com/pallets/markupsafe/archive/c0254f0cfe51720ecc9e72e8896022af29af5b44.tar.gz","allowedRedirectHosts":["github.com","codeload.github.com"],"sha256":"1826c5d89cc1aa0b3088f538726d339e0c5cd69fbe03f7b8f9a3f880474d1120"},"signature":{"status":"pending","fingerprint":null,"evidence":null},"pinToCommit":"pending","licenseDeclared":"BSD-3-Clause","licenseConcluded":null,"owner":"pallets","patches":[]}]}
